,id,title,all
0,19995,Avatar,james cameron sam worthington action culture clash
1,285,Pirates of the Caribbean: At World's End,gore verbinski johnny depp adventure ocean
2,206647,Spectre,sam mendes daniel craig action spy
3,49026,The Dark Knight Rises,christopher nolan christian bale action dc comics
4,49529,John Carter,andrew stanton taylor kitsch action based on novel
5,559,Spider-Man 3,sam raimi tobey maguire fantasy dual identity
6,38757,Tangled,byron howard zachary levi animation hostage
7,99861,Avengers: Age of Ultron,joss whedon robert downey jr. action marvel comic
8,767,Harry Potter and the Half-Blood Prince,david yates daniel radcliffe adventure witch
9,209112,Batman v Superman: Dawn of Justice,zack snyder ben affleck action dc comics
10,1452,Superman Returns,bryan singer brandon routh adventure saving the world
11,10764,Quantum of Solace,marc forster daniel craig adventure killing
12,58,Pirates of the Caribbean: Dead Man's Chest,gore verbinski johnny depp adventure witch
13,57201,The Lone Ranger,gore verbinski johnny depp action texas
14,49521,Man of Steel,zack snyder henry cavill action saving the world
15,2454,The Chronicles of Narnia: Prince Caspian,andrew adamson ben barnes adventure based on novel
16,24428,The Avengers,joss whedon robert downey jr. science fiction new york
17,1865,Pirates of the Caribbean: On Stranger Tides,rob marshall johnny depp adventure sea
18,41154,Men in Black 3,barry sonnenfeld will smith action time travel
19,122917,The Hobbit: The Battle of the Five Armies,peter jackson martin freeman action corruption
20,1930,The Amazing Spider-Man,marc webb andrew garfield action loss of father
21,20662,Robin Hood,ridley scott russell crowe action robin hood
22,57158,The Hobbit: The Desolation of Smaug,peter jackson martin freeman adventure elves
23,2268,The Golden Compass,chris weitz dakota blue richards adventure england
24,254,King Kong,peter jackson naomi watts adventure film business
25,597,Titanic,james cameron kate winslet drama shipwreck
26,271110,Captain America: Civil War,anthony russo chris evans adventure civil war
27,44833,Battleship,peter berg taylor kitsch thriller fight
28,135397,Jurassic World,colin trevorrow chris pratt action monster
29,37724,Skyfall,sam mendes daniel craig action spy
30,558,Spider-Man 2,sam raimi tobey maguire action dual identity
31,68721,Iron Man 3,shane black robert downey jr. action terrorist
32,12155,Alice in Wonderland,tim burton mia wasikowska family based on novel
33,36668,X-Men: The Last Stand,brett ratner hugh jackman adventure mutant
34,62211,Monsters University,dan scanlon billy crystal animation monster
35,8373,Transformers: Revenge of the Fallen,michael bay shia labeouf science fiction egypt
36,91314,Transformers: Age of Extinction,michael bay mark wahlberg science fiction sequel
37,68728,Oz: The Great and Powerful,sam raimi james franco fantasy circus
38,102382,The Amazing Spider-Man 2,marc webb andrew garfield action obsession
39,20526,TRON: Legacy,joseph kosinski garrett hedlund adventure artificial intelligence
40,49013,Cars 2,john lasseter owen wilson animation car race
41,44912,Green Lantern,martin campbell ryan reynolds adventure dc comics
42,10193,Toy Story 3,lee unkrich tom hanks animation hostage
43,534,Terminator Salvation,mcg christian bale action saving the world
44,168259,Furious 7,james wan vin diesel action car race
45,72190,World War Z,marc forster brad pitt action dystopia
46,127585,X-Men: Days of Future Past,bryan singer hugh jackman action 1970s
47,54138,Star Trek Into Darkness,j.j. abrams chris pine action spacecraft
48,81005,Jack the Giant Slayer,bryan singer nicholas hoult action based on fairy tale
49,64682,The Great Gatsby,baz luhrmann leonardo dicaprio drama based on novel
50,9543,Prince of Persia: The Sands of Time,mike newell jake gyllenhaal adventure persia
51,68726,Pacific Rim,guillermo del toro idris elba action dystopia
52,38356,Transformers: Dark of the Moon,michael bay shia labeouf action moon
53,217,Indiana Jones and the Kingdom of the Crystal Skull,steven spielberg harrison ford adventure saving the world
54,105864,The Good Dinosaur,peter sohn raymond ochoa adventure tyrannosaurus rex
55,62177,Brave,brenda chapman kelly macdonald animation scotland
56,188927,Star Trek Beyond,justin lin chris pine action sequel
57,10681,WALL·E,andrew stanton ben burtt animation romantic comedy
58,5174,Rush Hour 3,brett ratner chris tucker action ambassador
59,14161,2012,roland emmerich john cusack action civilization
60,17979,A Christmas Carol,robert zemeckis gary oldman animation holiday
61,76757,Jupiter Ascending,lilly wachowski mila kunis science fiction jupiter
62,258489,The Legend of Tarzan,david yates alexander skarsgård action africa
63,411,"The Chronicles of Narnia: The Lion, the Witch and the Wardrobe",andrew adamson william moseley adventure saving the world
64,246655,X-Men: Apocalypse,bryan singer james mcavoy science fiction mutant
65,155,The Dark Knight,christopher nolan christian bale drama dc comics
66,14160,Up,pete docter ed asner animation age difference
67,15512,Monsters vs Aliens,conrad vernon seth rogen animation alien
68,1726,Iron Man,jon favreau robert downey jr. action middle east
69,44826,Hugo,martin scorsese ben kingsley adventure library
70,8487,Wild Wild West,barry sonnenfeld will smith action steampunk
72,297761,Suicide Squad,david ayer will smith action dc comics
73,2698,Evan Almighty,tom shadyac steve carell fantasy father son relationship
74,137113,Edge of Tomorrow,doug liman tom cruise action deja vu
75,9804,Waterworld,kevin reynolds kevin costner adventure ocean
76,14869,G.I. Joe: The Rise of Cobra,stephen sommers dennis quaid adventure terrorist
77,150540,Inside Out,pete docter amy poehler drama dream
78,278927,The Jungle Book,jon favreau neel sethi family based on novel
79,10138,Iron Man 2,jon favreau robert downey jr. adventure malibu
80,58595,Snow White and the Huntsman,rupert sanders kristen stewart adventure queen
81,102651,Maleficent,robert stromberg angelina jolie fantasy fairy tale
82,119450,Dawn of the Planet of the Apes,matt reeves andy serkis science fiction leader
84,64686,47 Ronin,carl rinsch keanu reeves drama japan
85,100402,Captain America: The Winter Soldier,anthony russo chris evans action washington d.c.
86,10192,Shrek Forever After,mike mitchell mike myers comedy ogre
87,158852,Tomorrowland,brad bird britt robertson adventure inventor
88,177572,Big Hero 6,chris williams scott adsit adventure brother brother relationship
89,82690,Wreck-It Ralph,rich moore john c. reilly family support group
90,5255,The Polar Express,robert zemeckis tom hanks adventure santa claus
91,47933,Independence Day: Resurgence,roland emmerich liam hemsworth action alternate history
92,10191,How to Train Your Dragon,chris sanders jay baruchel fantasy flying
93,296,Terminator 3: Rise of the Machines,jonathan mostow arnold schwarzenegger action saving the world
94,118340,Guardians of the Galaxy,james gunn chris pratt action marvel comic
95,157336,Interstellar,christopher nolan matthew mcconaughey adventure saving the world
96,27205,Inception,christopher nolan leonardo dicaprio action loss of lover
97,315011,Shin Godzilla,hideaki anno hiroki hasegawa action monster
98,49051,The Hobbit: An Unexpected Journey,peter jackson ian mckellen adventure riddle
99,9799,The Fast and the Furious,rob cohen paul walker action street gang
100,4922,The Curious Case of Benjamin Button,david fincher cate blanchett fantasy diary
101,49538,X-Men: First Class,matthew vaughn james mcavoy action cia
102,131634,The Hunger Games: Mockingjay - Part 2,francis lawrence jennifer lawrence action revolution
103,27022,The Sorcerer's Apprentice,jon turteltaub nicolas cage fantasy witch
104,503,Poseidon,wolfgang petersen kurt russell adventure new year's eve
105,241259,Alice Through the Looking Glass,james bobin johnny depp fantasy based on novel
106,810,Shrek the Third,chris miller mike myers fantasy ambush
107,68735,Warcraft,duncan jones paula patton action video game
108,87101,Terminator Genisys,alan taylor arnold schwarzenegger science fiction saving the world
109,10140,The Chronicles of Narnia: The Voyage of the Dawn Treader,michael apted skandar keynes adventure based on novel
110,676,Pearl Harbor,michael bay ben affleck history nurse
111,1858,Transformers,michael bay shia labeouf adventure destroy
112,1966,Alexander,oliver stone colin farrell war aristotle
113,675,Harry Potter and the Order of the Phoenix,david yates daniel radcliffe adventure prophecy
114,674,Harry Potter and the Goblet of Fire,mike newell daniel radcliffe adventure magic
115,8960,Hancock,peter berg will smith fantasy flying
116,6479,I Am Legend,francis lawrence will smith drama saving the world
117,118,Charlie and the Chocolate Factory,tim burton johnny depp adventure london england
118,2062,Ratatouille,jan pinkava patton oswalt animation paris
119,272,Batman Begins,christopher nolan christian bale action himalaya
120,10527,Madagascar: Escape 2 Africa,eric darnell ben stiller family africa
121,18360,Night at the Museum: Battle of the Smithsonian,shawn levy ben stiller adventure museum
122,2080,X-Men Origins: Wolverine,gavin hood hugh jackman adventure corruption
123,605,The Matrix Revolutions,lilly wachowski keanu reeves adventure saving the world
124,109445,Frozen,chris buck kristen bell animation queen
125,604,The Matrix Reloaded,lilly wachowski keanu reeves adventure saving the world
126,76338,Thor: The Dark World,alan taylor chris hemsworth action marvel comic
127,76341,Mad Max: Fury Road,george miller tom hardy action future
128,13448,Angels & Demons,ron howard tom hanks thriller rome
129,10195,Thor,kenneth branagh chris hemsworth adventure new mexico
130,13053,Bolt,chris williams john travolta animation hamster
131,19585,G-Force,hoyt yeatman sam rockwell fantasy dyr
132,57165,Wrath of the Titans,jonathan liebesman sam worthington adventure underworld
133,62213,Dark Shadows,tim burton johnny depp comedy witch
134,177677,Mission: Impossible - Rogue Nation,christopher mcquarrie tom cruise action london england
135,7978,The Wolfman,joe johnston benicio del toro drama father son relationship
136,5559,Bee Movie,steve hickner jerry seinfeld family factory worker
137,49444,Kung Fu Panda 2,jennifer yuh nelson jack black animation martial arts
138,10196,The Last Airbender,m. night shyamalan noah ringer action fire
139,956,Mission: Impossible III,j.j. abrams tom cruise adventure berlin
140,117251,White House Down,roland emmerich channing tatum action usa president
141,50321,Mars Needs Moms,simon wells seth green adventure boy
142,11619,Flushed Away,david bowers hugh jackman adventure london england
143,266647,Pan,joe wright levi miller adventure flying
144,82703,Mr. Peabody & Sherman,rob minkoff ty burrell animation father son relationship
145,652,Troy,wolfgang petersen brad pitt adventure brother brother relationship
146,80321,Madagascar 3: Europe's Most Wanted,conrad vernon ben stiller animation madagascar
147,36669,Die Another Day,lee tamahori pierce brosnan adventure laser
148,43074,Ghostbusters,paul feig melissa mccarthy action female friendship
149,95,Armageddon,michael bay bruce willis action saving the world
150,608,Men in Black II,barry sonnenfeld tommy lee jones action saving the world
151,2310,Beowulf,robert zemeckis ray winstone adventure denmark
152,140300,Kung Fu Panda 3,jennifer yuh nelson jack black action china
153,56292,Mission: Impossible - Ghost Protocol,brad bird tom cruise action fight
154,81188,Rise of the Guardians,peter ramsey chris pine fantasy dream
155,7552,Fun with Dick and Jane,dean parisot jim carrey comedy based on novel
156,616,The Last Samurai,edward zwick tom cruise drama japan
157,147441,Exodus: Gods and Kings,ridley scott christian bale adventure moses
158,13475,Star Trek,j.j. abrams chris pine science fiction spacecraft
159,557,Spider-Man,sam raimi tobey maguire fantasy loss of lover
160,82702,How to Train Your Dragon 2,dean deblois jay baruchel fantasy father son relationship
161,205584,Gods of Egypt,alex proyas brenton thwaites fantasy egypt
162,10048,Stealth,rob cohen josh lucas action artificial intelligence
163,13183,Watchmen,zack snyder malin åkerman action dc comics
164,944,Lethal Weapon 4,richard donner mel gibson action lapd
165,1927,Hulk,ang lee eric bana drama california
166,72559,G.I. Joe: Retaliation,jon m. chu dwayne johnson adventure terror
167,7364,Sahara,breck eisner matthew mcconaughey action tyrant
168,2114,Final Fantasy: The Spirits Within,hironobu sakaguchi donald sutherland adventure battle assignment
169,1771,Captain America: The First Avenger,joe johnston chris evans action new york
170,36643,The World Is Not Enough,michael apted pierce brosnan adventure british
171,8619,Master and Commander: The Far Side of the World,peter weir russell crowe adventure naturalist
172,50620,The Twilight Saga: Breaking Dawn - Part 2,bill condon kristen stewart adventure vampire
173,65759,Happy Feet Two,george miller elijah wood animation penguin
174,1724,The Incredible Hulk,louis leterrier edward norton science fiction new york
175,267935,The BFG,steven spielberg ruby barnhill adventure london england
176,281957,The Revenant,alejandro gonzález iñárritu leonardo dicaprio western father son relationship
177,77950,Turbo,david soren ryan reynolds animation underdog
178,44896,Rango,gore verbinski johnny depp animation sheriff
179,270946,Penguins of Madagascar,eric darnell tom mcgrath family penguin
180,2503,The Bourne Ultimatum,paul greengrass matt damon action paris
181,9502,Kung Fu Panda,mark osborne jack black adventure china
182,102899,Ant-Man,peyton reed paul rudd science fiction marvel comic
183,101299,The Hunger Games: Catching Fire,francis lawrence jennifer lawrence adventure competition
184,228161,Home,tim johnson jim parsons fantasy friendship
185,74,War of the Worlds,steven spielberg tom cruise adventure post traumatic stress  disorder
186,8961,Bad Boys II,michael bay martin lawrence adventure miami
187,417859,Puss in Boots,chris miller antonio banderas action adventure
188,27576,Salt,phillip noyce angelina jolie action assassination
189,86834,Noah,darren aronofsky russell crowe drama bible
190,17578,The Adventures of Tintin,steven spielberg jamie bell adventure riddle
191,673,Harry Potter and the Prisoner of Azkaban,alfonso cuarón daniel radcliffe adventure flying
192,6972,Australia,baz luhrmann nicole kidman drama missionary
193,82700,After Earth,m. night shyamalan jaden smith science fiction dystopia
194,10567,Dinosaur,ralph zondag d. b. sweeney animation cataclysm
195,181533,Night at the Museum: Secret of the Tomb,shawn levy ben stiller adventure night watchman
196,38055,Megamind,tom mcgrath will ferrell animation saving the world
197,671,Harry Potter and the Philosopher's Stone,chris columbus daniel radcliffe adventure witch
198,49524,R.I.P.D.,robert schwentke jeff bridges fantasy gold
199,22,Pirates of the Caribbean: The Curse of the Black Pearl,gore verbinski johnny depp adventure exotic island
200,131631,The Hunger Games: Mockingjay - Part 1,francis lawrence jennifer lawrence science fiction resistance
201,591,The Da Vinci Code,ron howard tom hanks thriller paris
202,172385,Rio 2,carlos saldanha jesse eisenberg animation bird
203,36658,X2,bryan singer patrick stewart adventure mutant
204,51497,Fast Five,justin lin vin diesel action brazil
205,58574,Sherlock Holmes: A Game of Shadows,guy ritchie robert downey jr. adventure detective inspector
206,18823,Clash of the Titans,louis leterrier sam worthington adventure hades
207,861,Total Recall,paul verhoeven arnold schwarzenegger action oxygen
208,1911,The 13th Warrior,john mctiernan antonio banderas adventure witch
209,49040,The Bourne Legacy,tony gilroy jeremy renner action assassin
210,415,Batman & Robin,joel schumacher george clooney action double life
211,8871,How the Grinch Stole Christmas,ron howard jim carrey family holiday
212,435,The Day After Tomorrow,roland emmerich dennis quaid action saving the world
213,955,Mission: Impossible II,john woo tom cruise adventure terror
214,2133,The Perfect Storm,wolfgang petersen george clooney drama u.s. air force
215,1979,Fantastic 4: Rise of the Silver Surfer,tim story ioan gruffudd adventure fire
216,87827,Life of Pi,ang lee suraj sharma adventure ocean
217,1250,Ghost Rider,mark steven johnson nicolas cage thriller mephisto
218,324668,Jason Bourne,paul greengrass matt damon action assassin
219,9471,Charlie's Angels: Full Throttle,mcg cameron diaz action robbery
220,70981,Prometheus,ridley scott noomi rapace science fiction android
221,10996,Stuart Little 2,rob minkoff michael j. fox family mouse
222,68724,Elysium,neill blomkamp matt damon science fiction dystopia
223,2789,The Chronicles of Riddick,david twohy vin diesel action prison
224,97020,RoboCop,josé padilha joel kinnaman action cyborg
225,7459,Speed Racer,lilly wachowski emile hirsch action car race
226,42888,How Do You Know,james l. brooks reese witherspoon comedy love triangle
227,37834,Knight and Day,james mangold tom cruise action spy
228,75612,Oblivion,joseph kosinski tom cruise action spacecraft
229,1895,Star Wars: Episode III - Revenge of the Sith,george lucas ewan mcgregor science fiction showdown
230,1894,Star Wars: Episode II - Attack of the Clones,george lucas ewan mcgregor adventure senate
231,585,"Monsters, Inc.",pete docter john goodman animation monster
232,76170,The Wolverine,james mangold hugh jackman action japan
233,1893,Star Wars: Episode I - The Phantom Menace,george lucas liam neeson adventure prophecy
234,49519,The Croods,chris sanders nicolas cage adventure stone age
235,2395,Asterix at the Olympic Games,thomas langmann clovis cornillac fantasy competition
236,12100,Windtalkers,john woo nicolas cage drama japan
237,290595,The Huntsman: Winter's War,cedric nicolas-troyan chris hemsworth action witch
238,98566,Teenage Mutant Ninja Turtles,jonathan liebesman megan fox science fiction martial arts
239,49047,Gravity,alfonso cuarón sandra bullock science fiction space mission
240,9619,Dante's Peak,roger donaldson pierce brosnan action helicopter
241,308531,Teenage Mutant Ninja Turtles: Out of the Shadows,dave green megan fox fantasy brother brother relationship
242,166424,Fantastic Four,josh trank miles teller action teleportation
243,1593,Night at the Museum,shawn levy ben stiller action museum
244,254128,San Andreas,brad peyton dwayne johnson action california
245,714,Tomorrow Never Dies,roger spottiswoode pierce brosnan adventure london england
246,2024,The Patriot,roland emmerich mel gibson drama rebel
247,163,Ocean's Twelve,steven soderbergh george clooney thriller sequel
248,787,Mr. & Mrs. Smith,doug liman angelina jolie action bomb
249,262500,Insurgent,robert schwentke shailene woodley adventure based on novel
250,2567,The Aviator,martin scorsese leonardo dicaprio drama ladykiller
251,38745,Gulliver's Travels,rob letterman jack black comedy journalist
252,40805,The Green Hornet,michel gondry seth rogen action bomb
253,53182,300: Rise of an Empire,noam murro sullivan stapleton action based on graphic novel
254,41513,The Smurfs,raja gosnell hank azaria animation moon
255,13700,Home on the Range,will finn roseanne barr animation farm
256,262504,Allegiant,robert schwentke shailene woodley adventure based on novel
257,39254,Real Steel,shawn levy hugh jackman action father son relationship
258,77931,The Smurfs 2,raja gosnell hank azaria fantasy based on cartoon
259,1639,Speed 2: Cruise Control,jan de bont sandra bullock action boat
260,80274,Ender's Game,gavin hood asa butterfield science fiction based on novel
261,1571,Live Free or Die Hard,len wiseman bruce willis action usa
262,120,The Lord of the Rings: The Fellowship of the Ring,peter jackson elijah wood adventure elves
263,10204,Around the World in 80 Days,frank coraci jackie chan action paris
264,8489,Ali,michael mann will smith drama usa
265,10588,The Cat in the Hat,bo welch mike myers comedy cat
266,2048,"I, Robot",alex proyas will smith action suicide
267,1495,Kingdom of Heaven,ridley scott orlando bloom drama crusade
268,10137,Stuart Little,rob minkoff michael j. fox animation brother brother relationship
269,10198,The Princess and the Frog,ron clements anika noni rose romance based on novel
270,286217,The Martian,ridley scott matt damon drama based on novel
271,1635,The Island,michael bay ewan mcgregor action clone
272,24113,Town & Country,peter chelsom warren beatty comedy architect
273,9679,Gone in Sixty Seconds,dominic sena nicolas cage action brother brother relationship
274,98,Gladiator,ridley scott russell crowe action rome
275,180,Minority Report,steven spielberg tom cruise action self-fulfilling prophecy
276,672,Harry Potter and the Chamber of Secrets,chris columbus daniel radcliffe adventure flying car
277,36557,Casino Royale,martin campbell daniel craig adventure italy
278,869,Planet of the Apes,tim burton mark wahlberg thriller gorilla
279,280,Terminator 2: Judgment Day,james cameron arnold schwarzenegger action cyborg
280,11322,Public Enemies,michael mann christian bale history cinema
281,4982,American Gangster,ridley scott denzel washington drama underdog
282,36955,True Lies,james cameron arnold schwarzenegger action spy
283,18487,The Taking of Pelham 1 2 3,tony scott denzel washington thriller hostage
284,39451,Little Fockers,paul weitz robert de niro comedy nurse
285,27581,The Other Guys,adam mckay will ferrell action narration
286,9268,Eraser,chuck russell arnold schwarzenegger action suicide
287,68718,Django Unchained,quentin tarantino jamie foxx drama bounty hunter
288,10545,The Hunchback of Notre Dame,gary trousdale tom hulce drama paris
289,11688,The Emperor's New Groove,mark dindal david spade adventure central and south america
290,76163,The Expendables 2,simon west sylvester stallone action airplane
291,2059,National Treasure,jon turteltaub nicolas cage adventure riddle
292,2486,Eragon,stefen fangmeier ed speleers fantasy based on novel
293,16523,Where the Wild Things Are,spike jonze max records family children's book
294,116711,Epic,chris wedge josh hutcherson animation fantasy
295,37710,The Tourist,florian henckel von donnersmarck johnny depp action paris
296,9946,End of Days,peter hyams arnold schwarzenegger action christianity
297,1372,Blood Diamond,edward zwick leonardo dicaprio drama rebel
298,106646,The Wolf of Wall Street,martin scorsese leonardo dicaprio crime corruption
299,414,Batman Forever,joel schumacher val kilmer action riddle
300,563,Starship Troopers,paul verhoeven casper van dien adventure moon
301,83542,Cloud Atlas,tom tykwer tom hanks drama clone
302,41216,Legend of the Guardians: The Owls of Ga'Hoole,zack snyder emily barclay animation owl
303,314,Catwoman,pitof halle berry action white russian
304,184315,Hercules,brett ratner dwayne johnson action mercenary
305,9016,Treasure Planet,ron clements joseph gordon-levitt adventure cyborg
306,18162,Land of the Lost,brad silberling will ferrell adventure alien life-form
307,138103,The Expendables 3,patrick hughes sylvester stallone action cia
308,257088,Point Break,ericson core edgar ramírez action undercover
309,10214,Son of the Mask,lawrence guterman jamie kennedy fantasy baby
310,205775,In the Heart of the Sea,ron howard chris hemsworth thriller suicide
311,11692,The Adventures of Pluto Nash,ron underwood eddie murphy action moon
312,22972,Green Zone,paul greengrass matt damon war weapon of mass destruction
313,227973,The Peanuts Movie,steve martino noah schnapp animation based on comic strip
314,29193,The Spanish Prisoner,david mamet steve martin crime dialogue
315,1734,The Mummy Returns,stephen sommers brendan fraser adventure son
316,3131,Gangs of New York,martin scorsese leonardo dicaprio drama fire
317,76758,The Flowers of War,zhang yimou christian bale drama forced prostitution
318,9408,Surf's Up,ash brannon shia labeouf animation sea
319,9890,The Stepford Wives,frank oz nicole kidman action android
320,855,Black Hawk Down,ridley scott josh hartnett action prisoners of war
321,77953,The Campaign,jay roach will ferrell comedy politics
322,18,The Fifth Element,luc besson bruce willis adventure clone
324,10501,The Road to El Dorado,don michael paul kenneth branagh adventure gold
325,57800,Ice Age: Continental Drift,steve martino john leguizamo animation blue footed booby
326,150689,Cinderella,kenneth branagh lily james romance cinderella
327,7980,The Lovely Bones,peter jackson rachel weisz fantasy rape
328,12,Finding Nemo,andrew stanton albert brooks animation father son relationship
329,122,The Lord of the Rings: The Return of the King,peter jackson elijah wood adventure elves
330,121,The Lord of the Rings: The Two Towers,peter jackson elijah wood adventure elves
331,68737,Seventh Son,sergei bodrov jeff bridges adventure magic
332,1995,Lara Croft: Tomb Raider,simon west angelina jolie adventure treasure
333,157353,Transcendence,wally pfister johnny depp thriller artificial intelligence
334,331,Jurassic Park III,joe johnston sam neill adventure exotic island
335,61791,Rise of the Planet of the Apes,rupert wyatt james franco thriller intelligence
336,8204,The Spiderwick Chronicles,mark waters freddie highmore adventure brother sister relationship
337,47964,A Good Day to Die Hard,john moore bruce willis action bomb
338,10733,The Alamo,john lee hancock dennis quaid western texas
339,9806,The Incredibles,brad bird craig t. nelson action secret identity
340,1408,Cutthroat Island,renny harlin geena davis action exotic island
341,32657,Percy Jackson & the Olympians: The Lightning Thief,chris columbus logan lerman adventure monster
342,607,Men in Black,barry sonnenfeld tommy lee jones action secret identity
343,863,Toy Story 2,john lasseter tom hanks animation museum
344,44048,Unstoppable,tony scott denzel washington action runaway train
345,5175,Rush Hour 2,brett ratner chris tucker action duringcreditsstinger
346,2655,What Lies Beneath,robert zemeckis harrison ford drama secret
