,id,title,all
3419,38415,Bran Nue Dae,rachel perkins rocky mckenzie comedy musical
3420,650,Boyz n the Hood,john singleton laurence fishburne crime street gang
3421,16620,La Bamba,luis valdez lou diamond phillips drama musical
3423,11033,Dressed to Kill,brian de palma michael caine horror transvestism
3424,34723,The Adventures of Huck Finn,stephen sommers elijah wood action southern accent
3425,9430,Go,doug liman sarah polley crime ecstasy
3426,8998,Friends with Money,nicole holofcener catherine keener comedy midlife crisis
3427,10514,The Andromeda Strain,robert wise arthur hill science fiction nasa
3428,10496,Bats,louis morneau lou diamond phillips horror mutation
3429,1591,Nowhere in Africa,caroline link juliane köhler drama loss of family
3430,76025,Shame,steve mcqueen michael fassbender drama pornography
3431,4836,Layer Cake,matthew vaughn daniel craig drama kidnapping
3433,87499,The East,zal batmanglij brit marling drama secret organization
3434,18923,A Home at the End of the World,michael mayer colin farrell romance gay
3435,26665,Aberdeen,hans petter moland stellan skarsgård drama alcohol
3436,28089,The Messenger,oren moverman ben foster drama independent film
3438,5708,Control,anton corbijn sam riley drama manchester city
3439,218,The Terminator,james cameron arnold schwarzenegger action saving the world
3440,338,"Good bye, Lenin!",wolfgang becker daniel brühl comedy bureaucracy
3441,21641,The Damned United,tom hooper michael sheen drama england
3442,10925,The Return of the Living Dead,dan o'bannon clu gulager comedy female nudity
3443,2293,Mallrats,kevin smith jason lee romance sex
3444,621,Grease,randal kleiser john travolta romance flying car
3445,792,Platoon,oliver stone tom berenger drama famous score
3446,1777,Fahrenheit 9/11,michael moore robert de niro documentary usa president
3447,642,Butch Cassidy and the Sundance Kid,george roy hill paul newman history wyoming
3448,433,Mary Poppins,robert stevenson julie andrews comedy london england
3449,16619,Ordinary People,robert redford donald sutherland drama post traumatic stress  disorder
3450,1725,West Side Story,robert wise natalie wood crime slum
3451,11977,Caddyshack,harold ramis chevy chase comedy golf
3452,20322,The Brothers,gary hardwick morris chestnut comedy independent film
3454,629,The Usual Suspects,bryan singer stephen baldwin drama law
3455,10160,A Nightmare on Elm Street 5: The Dream Child,stephen hopkins robert englund horror nun
3456,11452,National Lampoon’s Van Wilder,walt becker ryan reynolds comedy male nudity
3457,12163,The Wrestler,darren aronofsky mickey rourke drama supermarket
3458,32275,Duel in the Sun,king vidor jennifer jones western half breed
3459,13785,Best in Show,christopher guest jay brazeau comedy illinois
3460,1103,Escape from New York,john carpenter kurt russell science fiction taxi
3461,36739,School Daze,spike lee samuel l. jackson comedy musical
3462,14144,Daddy Day Camp,fred savage cuba gooding jr. comedy competition
3463,10622,Mr. Nice Guy,sammo hung jackie chan crime journalist
3464,13370,A Mighty Wind,christopher guest bob balaban comedy mockumentary
3465,11191,Mystic Pizza,donald petrie annabeth gish comedy independent film
3466,10215,Sliding Doors,peter howitt gwyneth paltrow comedy double life
3467,25066,Tales from the Hood,rusty cundieff clarence williams iii crime prison
3468,1523,The Last King of Scotland,kevin macdonald forest whitaker drama dictator
3469,11361,Halloween 5: The Revenge of Michael Myers,dominique othenin-girard donald pleasence horror sheriff
3470,92591,Bernie,richard linklater jack black comedy prison visit
3472,12509,Pollock,ed harris ed harris drama artist
3473,15256,200 Cigarettes,risa bramon garcia ben affleck comedy new year's eve
3474,83686,The Words,brian klugman bradley cooper drama plagiarized book
3475,80304,Casa De Mi Padre,matt piedmont will ferrell comedy mexico
3476,28053,City Island,raymond de felitta andy garcía drama secret
3477,67913,The Guard,john michael mcdonagh brendan gleeson action prostitute
3478,13991,College,deb hagan drake bell comedy sexuality
3479,1443,The Virgin Suicides,sofia coppola james woods drama michigan
3480,8545,Little Voice,mark herman brenda blethyn comedy parents kids relationship
3481,19556,Miss March,zach cregger zach cregger comedy sex
3482,231576,Wish I Was Here,zach braff zach braff drama jew
3483,16172,Simply Irresistible,mark tarlov sarah michelle gellar comedy restaurant
3484,13403,Hedwig and the Angry Inch,john cameron mitchell john cameron mitchell comedy transvestism
3488,20794,Novocaine,david atkins chelcie ross comedy murder
3489,31064,The Business of Strangers,patrick stettner julia stiles drama rape
3490,576,The Wild Bunch,sam peckinpah william holden adventure underdog
3491,13990,The Wackness,jonathan levine ben kingsley drama coming of age
3492,11583,The First Great Train Robbery,michael crichton sean connery thriller public hanging
3493,18602,Morvern Callar,lynne ramsay samantha morton drama independent film
3494,27549,Beastmaster 2: Through the Portal of Time,sylvio tabet marc singer action based on novel
3495,59728,The 5th Quarter,rick bieber aidan quinn drama american football
3496,10930,The Flower of Evil,claude chabrol benoît magimel drama return
3497,32395,The Greatest,shana feste pierce brosnan drama woman director
3498,58882,Snow Flower and the Secret Fan,wayne wang li bingbing drama fan
3499,7547,Come Early Morning,joey lauren adams ashley judd drama bar
3501,42222,Julia,fred zinnemann jane fonda drama friends
3502,13827,"Surfer, Dude",s.r. bindler matthew mcconaughey comedy surfing
3504,9282,11:14,greg marcks henry thomas crime alcohol
3505,38940,Men of War,perry lang dolph lundgren action asia
3506,35689,Don McKay,jake goldberger thomas haden church crime independent film
3507,97614,Deadfall,stefan ruzowitzky eric bana crime partner
3508,37206,A Shine of Rainbows,vic sarin connie nielsen drama orphan
3511,837,Videodrome,david cronenberg james woods horror suicide
3512,1555,The Spanish Apartment,cédric klapisch romain duris drama paris
3513,244783,Song One,kate barker-froyland anne hathaway drama woman director
3514,16564,Winter in Wartime,martin koolhoven martijn lakemeier drama netherlands
3515,168027,Freaky Deaky,charles matthau christian slater comedy bomb squad
3516,3482,The Train,john frankenheimer burt lancaster action paris
3518,8982,The Protector,prachya pinkaew tony jaa action buddhism
3519,89861,Stiff Upper Lips,gary sinyor georgina cates comedy italy
3520,455,Bend It Like Beckham,gurinder chadha parminder nagra comedy london england
3521,57022,Sunshine State,john sayles alan king drama independent film
3522,14351,Crossover,preston a. whitmore ii anthony mackie action street gang
3524,10664,[REC]²,jaume balagueró manuela velasco thriller religion and supernatural
3526,9277,The Sting,george roy hill paul newman comedy chicago
3527,9443,Chariots of Fire,hugh hudson ben cross drama underdog
3529,7863,Shine,scott hicks geoffrey rush drama letter
3530,138697,Don Jon,joseph gordon-levitt joseph gordon-levitt romance pornography
3531,11901,High Plains Drifter,clint eastwood clint eastwood western gunslinger
3532,1548,Ghost World,terry zwigoff thora birch comedy high school friends
3533,11889,Iris,richard eyre judi dench drama based on novel
3534,33155,Galaxina,william sachs dorothy stratten comedy android
3535,5528,The Chorus,christophe barratier gérard jugnot drama penalty
3536,321,Mambo Italiano,émile gaudreault luke kirby comedy gay
3537,4997,Wonderland,james cox val kilmer crime robbery
3538,925,Do the Right Thing,spike lee danny aiello drama black people
3539,27451,Harvard Man,james toback sarah michelle gellar drama gambling
3540,73532,Le Havre,aki kaurismäki andré wilms drama poverty
3541,979,Irreversible,gaspar noé monica bellucci drama paris
3542,193722,R100,hitoshi matsumoto nao omori comedy dominatrix
3543,7913,Rang De Basanti,rakeysh omprakash mehra aamir khan drama new delhi india
3545,51995,Salvation Boulevard,george ratliff jennifer connelly comedy pastor
3546,13173,The Ten,david wain paul rudd comedy independent film
3547,22908,A Room for Romeo Brass,shane meadows paddy considine drama rejection
3548,70670,Headhunters,morten tyldum aksel hennie thriller death of lover
3549,84204,Grabbers,jon wright richard coyle science fiction monster
3550,25248,Saint Ralph,michael mcgowan adam butcher comedy sport
3552,16633,Somewhere in Time,jeannot szwarc christopher reeve science fiction time travel
3553,63006,Dum Maaro Dum,rohan sippy abhishek bachchan drama goa
3554,91586,Insidious: Chapter 2,james wan patrick wilson horror haunted house
3555,215,Saw II,darren lynn bousman tobin bell horror riddle
3556,333371,10 Cloverfield Lane,dan trachtenberg mary elizabeth winstead thriller kidnapping
3557,9012,Jackass: The Movie,jeff tremaine johnny knoxville documentary disgust
3558,345911,Lights Out,david f. sandberg teresa palmer horror suicide
3559,72571,Paranormal Activity 3,henry joost katie featherston horror witch
3560,242512,Ouija,stiles white olivia cooke horror death of a friend
3561,10072,A Nightmare on Elm Street 3: Dream Warriors,chuck russell robert englund horror group therapy
3562,211954,Instructions Not Included,eugenio derbez loreto peralta comedy bachelor
3563,82990,Paranormal Activity 4,henry joost katie featherston horror garage
3564,29912,The Robe,henry koster richard burton drama crucifixion
3565,11843,The Return of the Pink Panther,blake edwards peter sellers comedy robbery
3566,11284,Freddy's Dead: The Final Nightmare,rachel talalay robert englund horror amnesia
3567,504,Monster,patty jenkins charlize theron crime female nudity
3568,173,"20,000 Leagues Under the Sea",richard fleischer kirk douglas adventure diving
3569,227348,Paranormal Activity: The Marked Ones,christopher b. landon andrew jacobs horror supernatural
3570,1955,The Elephant Man,david lynch anthony hopkins drama exploitation
3571,152532,Dallas Buyers Club,jean-marc vallée matthew mcconaughey drama women
3572,243940,The Lazarus Effect,david gelb olivia wilde thriller terror
3573,77,Memento,christopher nolan guy pearce mystery individual
3574,157547,Oculus,mike flanagan karen gillan horror hallucination
3575,2295,Clerks II,kevin smith brian o'halloran comedy independent film
3576,71,Billy Elliot,stephen daldry jamie bell drama workers' quarter
3577,147773,The Way Way Back,nat faxon liam james comedy shyness
3579,24266,The Man from Snowy River,george t. miller tom burlinson family regret
3581,2895,The Apostle,robert duvall robert duvall drama christianity
3582,15660,Mommie Dearest,frank perry faye dunaway drama ax
3583,59968,Our Idiot Brother,jesse peretz paul rudd comedy brother sister relationship
3584,323677,Race,stephen hopkins stephan james action olympic games
3585,19848,The Players Club,ice cube lisaraye mccoy drama strip club
3586,256274,"As Above, So Below",john erick dowdle perdita weeks horror paris
3587,235271,Addicted,bille woodruff boris kodjoe drama infidelity
3588,45153,Eve's Bayou,kasi lemmons jurnee smollett drama sister sister relationship
3589,284293,Still Alice,richard glatzer julianne moore drama mother
3590,24973,The Egyptian,michael curtiz jean simmons history egypt
3592,10283,Friday the 13th Part VIII: Jason Takes Manhattan,rob hedden kane hodder horror new york
3593,8346,My Big Fat Greek Wedding,joel zwick nia vardalos comedy usa
3594,122081,Spring Breakers,harmony korine james franco drama female nudity
3595,10987,Halloween: The Curse of Michael Myers,joe chappelle donald pleasence horror mass murder
3596,1391,Y Tu Mamá También,alfonso cuarón gael garcía bernal drama mexico
3597,747,Shaun of the Dead,edgar wright simon pegg horror record collection
3599,26748,Lone Star,john sayles chris cooper drama sheriff
3600,11357,Halloween 4: The Return of Michael Myers,dwight h. little donald pleasence horror sheriff
3601,24913,April Fool's Day,fred walton deborah foreman horror island
3602,13776,Diner,barry levinson steve guttenberg comedy diner
3603,14854,Lone Wolf McQuade,steve carver chuck norris action martial arts
3604,50357,Apollo 18,gonzalo lópez-gallego ryan robbins horror moon
3605,13090,Sunshine Cleaning,christine jeffs amy adams comedy suicide
3606,192141,No Escape,john erick dowdle owen wilson action hotel
3607,16441,The Beastmaster,don coscarelli marc singer action sword fight
3608,29996,Solomon and Sheba,king vidor yul brynner drama israel
3609,351819,Fifty Shades of Black,michael tiddes marlon wayans romance sex
3611,22649,A Farewell to Arms,frank borzage helen hayes drama italy
3612,378200,The Perfect Match,bille woodruff terrence jenkins comedy bet
3613,20455,Digimon: The Movie,mamoru hosoda lara jill miller fantasy video game
3614,13193,Saved!,brian dannelly jena malone comedy christianity
3615,11042,The Barbarian Invasions,denys arcand rémy girard comedy father son relationship
3616,10786,Robin and Marian,richard lester sean connery action england
3617,12484,The Forsaken,j.s. cardone kerr smith action vampire
3618,17339,Force 10 from Navarone,guy hamilton harrison ford action gun
3619,11959,UHF,"jay levey ""weird al"" yankovic comedy loser"
3620,9900,Grandma's Boy,nicholaus goossen linda cardellini comedy video game
3621,14662,Slums of Beverly Hills,tamara jenkins natasha lyonne comedy sex
3622,335,Once Upon a Time in the West,sergio leone henry fonda western showdown
3624,17431,Moon,duncan jones sam rockwell science fiction moon
3625,21014,Keeping Up with the Steins,scott marshall daryl sabara comedy bar mitvah
3626,78394,Sea Rex 3D: Journey to a Prehistoric World,ronan chapalain guillaume denaiffe documentary prehistoric
3627,10217,The Sweet Hereafter,atom egoyan ian holm drama canada
3628,46332,Of Gods and Men,xavier beauvois lambert wilson drama monk
3629,13996,Bottle Shock,randall miller alan rickman comedy wine garden
3630,3028,Jekyll and Hyde ... Together Again,jerry belson mark blankfield comedy double life
3631,1024,Heavenly Creatures,peter jackson melanie lynskey drama mother
3632,343795,90 Minutes in Heaven,michael polish kate bosworth drama hospital
3633,45658,Everything Must Go,dan rush rebecca hall comedy alcohol
3634,16148,Zero Effect,jake kasdan bill pullman comedy detective
3635,4553,The Machinist,brad anderson christian bale thriller factory
3636,36351,Light Sleeper,paul schrader willem dafoe drama suicide
3637,245916,Kill the Messenger,michael cuesta jeremy renner thriller biography
3638,27585,Rabbit Hole,john cameron mitchell nicole kidman drama loss of son
3639,1415,Party Monster,fenton bailey seth green comedy new york
3640,313922,Green Room,jeremy saulnier anton yelchin horror skinhead
3641,14474,The Oh in Ohio,billy kent parker posey comedy sex
3642,199933,Atlas Shrugged Part III: Who is John Galt?,james manera eric allan kramer drama trilogy
3643,13685,Bottle Rocket,wes anderson luke wilson comedy brother brother relationship
3644,8744,Albino Alligator,kevin spacey matt dillon crime brother brother relationship
3645,38428,"Gandhi, My Father",feroz abbas khan darshan jariwala drama biography
3646,8847,Standard Operating Procedure,errol morris javal davis documentary prison
3647,39269,Out of the Blue,dennis hopper dennis hopper drama punk
3648,46838,Tucker and Dale vs Evil,eli craig alan tudyk comedy cabin
3650,56930,Tycoon,richard wallace john wayne action mountains
3651,41730,Desert Blue,morgan j. freeman casey affleck comedy bomb
3653,298312,The Visit,m. night shyamalan olivia dejonge horror rap music
3654,11600,Redacted,brian de palma izzy diaz drama iraq
3655,71547,Fascination,klaus menzel jacqueline bisset romance beach
3656,57876,Area 51,oren peli reid warner horror found footage
3657,77495,Sleep Tight,jaume balagueró luis tosar thriller barcelona spain
3658,13849,The Cottage,paul andrew williams andy serkis horror ransom
3659,14849,Dead Like Me: Life After Death,stephen herek ellen muth drama suicide
3660,12486,Farce of the Penguins,bob saget samuel l. jackson comedy penguin
3662,244403,Rudderless,william h. macy billy crudup music father son relationship
3663,292481,Henry & Me,barrett esposito richard gere family baseball
3664,340816,Christmas Eve,mitch davis patrick stewart romance photographer
3666,297596,Dying of the Light,paul schrader nicolas cage thriller cia
3667,299552,Born Of War,vicky jewson james frain action gun
3668,11935,Capricorn One,peter hyams elliott gould drama helicopter
3671,290825,Yoga Hosers,kevin smith lily-rose depp comedy canada
3672,361159,Navy Seals vs. Zombies,stanton barrett ed quinn horror louisiana
3673,12555,I Served the King of England,jiří menzel ivan barnev comedy expensive restaurant
3675,12498,Sling Blade,billy bob thornton billy bob thornton drama independent film
3676,77949,The Awakening,nick murphy  rebecca hall horror suicide
3677,1690,Hostel,eli roth jay hernandez horror bathroom
3678,8435,A Cock and Bull Story,michael winterbottom steve coogan comedy adaptation
3679,64720,Take Shelter,jeff nichols michael shannon thriller shelter
3680,49365,Lady in White,frank laloggia lukas haas horror small town
3681,11404,Driving Lessons,jeremy brock laura linney drama auto
3682,300706,Let's Kill Ward's Wife,scott foley patrick wilson comedy wife murder
3683,16337,The Texas Chainsaw Massacre 2,tobe hooper dennis hopper horror hammer
3684,11577,Pat Garrett & Billy the Kid,sam peckinpah james coburn western sheriff
3685,77987,Only God Forgives,nicolas winding refn ryan gosling drama bangkok
3687,68202,Without Men,gabriela tagliavini eva longoria comedy woman director
3688,8981,Dear Frankie,shona auerbach gerard butler drama scotland
3689,10914,All Hat,leonard farlinger rachael leigh cook action indian territory
3690,50848,The Names of Love,michel leclerc jacques gamblin drama female nudity
3691,166624,Treading Water,analeine cal y mayor douglas smith drama fish
3692,10822,Savage Grace,tom kalin julianne moore drama mother
3693,10844,Out of the Blue,robert sarkies karl urban drama new zealand
3694,9336,Police Academy,hugh wilson steve guttenberg comedy trainer
3695,5689,The Blue Lagoon,randal kleiser brooke shields romance sexual identity
3696,712,Four Weddings and a Funeral,mike newell hugh grant comedy upper class
3697,13342,Fast Times at Ridgemont High,amy heckerling sean penn comedy sex
3698,10339,Moby Dick,john huston gregory peck adventure based on novel
3699,1429,25th Hour,spike lee edward norton crime prison
3700,9303,Bound,lilly wachowski jennifer tilly crime prison
3701,641,Requiem for a Dream,darren aronofsky ellen burstyn crime drug addiction
3702,27686,State Fair,walter lang jeanne crain music state fair
3704,6106,Salvador,oliver stone james woods drama civil war
3705,252680,Moms' Night Out,jon erwin sarah drew comedy wife husband relationship
3706,141,Donnie Darko,richard kelly jake gyllenhaal fantasy parents kids relationship
3709,12079,Spun,jonas åkerlund jason schwartzman comedy independent film
3710,39800,Life During Wartime,todd solondz ally sheedy comedy dark comedy
3711,4550,Sympathy for Lady Vengeance,park chan-wook choi min-sik drama independent film
3713,9991,Mean Machine,barry skolnick vinnie jones comedy prison
3715,68818,Blackthorn,mateo gil sam shepard adventure robbery
3716,12093,Lilya 4-ever,lukas moodysson oksana akinshina crime suicide
3717,36419,After.Life,agnieszka wojtowicz-vosloo liam neeson drama wheelchair
3719,510,One Flew Over the Cuckoo's Nest,miloš forman jack nicholson drama individual
3721,10970,Silent Movie,mel brooks mel brooks comedy screenplay
3722,375290,Airlift,raja menon akshay kumar thriller evacuation
3723,17663,Anne of Green Gables,kevin sullivan megan follows drama based on novel
3724,270938,Falcon Rising,ernie barbarash michael jai white adventure yakuza
3725,116613,The Sweeney,nick love ray winstone action british
3726,11826,Sexy Beast,jonathan glazer ray winstone crime spain
3727,29920,Easy Money,daniel espinosa joel kinnaman drama consignment
3728,1088,Whale Rider,niki caro keisha castle-hughes drama ocean
3730,34069,Cargo,ivan engler martin rapold thriller space colony
3731,10947,High School Musical,kenny ortega zac efron comedy becoming an adult
3732,47452,Love and Death on Long Island,richard kwietniowski john hurt drama obsession
3733,3040,Night Watch,timur bekmambetov konstantin khabenskiy fantasy witch
3734,11386,The Crying Game,neil jordan stephen rea romance transvestism
3735,10246,Porky's,bob clark dan monahan comedy male nudity
3736,29426,Survival of the Dead,george a. romero alan van sprang horror zombie
3737,10331,Night of the Living Dead,george a. romero duane jones horror brother sister relationship
3738,153,Lost in Translation,sofia coppola bill murray drama upper class
3739,703,Annie Hall,woody allen woody allen comedy narration
3740,27191,The Greatest Show on Earth,cecil b. demille betty hutton action circus
3741,1365,Monster's Ball,marc forster halle berry drama southern usa
3742,287424,Maggie,henry hobson arnold schwarzenegger horror post-apocalyptic
3743,451,Leaving Las Vegas,mike figgis nicolas cage drama individual
3744,165864,Hansel and Gretel Get Baked,duane journey molly c. quinn horror witch
3745,987,The Front Page,billy wilder jack lemmon romance chicago
3746,241251,The Boy Next Door,rob cohen jennifer lopez thriller male nudity
3747,40494,Trapeze,carol reed burt lancaster drama circus
3748,39781,The Kids Are All Right,lisa cholodenko julianne moore comedy lesbian relationship
3749,8337,They Live,john carpenter roddy piper action dystopia
3750,5925,The Great Escape,john sturges steve mcqueen adventure based on novel
3751,8357,What the #$*! Do We (K)now!?,william arntz marlee matlin documentary alternate dimension
3752,146203,The Last Exorcism Part II,ed gass-donnelly ashley bell horror found footage
3753,85350,Boyhood,richard linklater ellar coltrane drama daily life
3754,512,Scoop,woody allen scarlett johansson comedy upper class
3755,13408,The Wash,dj pooh dr. dre action sex
3756,47816,3 Strikes,dj pooh brian hooks action sport
3757,10744,The Cooler,wayne kramer william h. macy drama casino
3758,11536,The Misfits,john huston clark gable drama decision
3759,9782,The Night Listener,patrick stettner toni collette drama radio station
3760,18713,The Jerky Boys,james melkonian john g. brennan comedy new york
3761,6537,The Orphanage,juan antonio bayona belén rueda horror schizophrenia
3762,184345,A Haunted House 2,michael tiddes marlon wayans comedy haunted house
3763,1809,The Rules of Attraction,roger avary james van der beek comedy love triangle
3764,2370,Topaz,alfred hitchcock frederick stafford action new york
3765,9809,Let's Go to Prison,bob odenkirk dax shepard comedy loss of father
3766,5,Four Rooms,allison anders tim roth crime hotel
3767,11013,Secretary,steven shainberg james spader comedy suicide
3769,10132,Talk Radio,oliver stone eric bogosian drama anonymity
3770,16448,Waiting for Guffman,christopher guest christopher guest music missouri
3771,15122,Love Stinks,jeff franklin french stewart comedy behind the scenes
3772,8141,You Kill Me,john dahl ben kingsley comedy new york
3773,1546,Thumbsucker,mike mills lou taylor pucci comedy becoming an adult
3774,48572,Red State,kevin smith michael parks horror christianity
3775,14517,Mirrormask,dave mckean stephanie leonidas fantasy fictional place
3777,27551,The Barbarians,ruggero deodato peter paul fantasy dragon
3778,64678,The Art of Getting By,gavin wiesen freddie highmore drama philosophy
3779,309503,Zipper,mora stephens patrick wilson thriller woman director
3780,14293,Poolhall Junkies,mars callahan ricky schroder comedy hustler
3782,103328,Holy Motors,leos carax eva mendes drama limousine
3783,157847,Joe,david gordon green nicolas cage drama child abuse
3784,25719,Shooting Fish,stefan schwartz dan futterman crime london england
3785,48309,Prison,renny harlin viggo mortensen crime prison
3786,27723,Psycho Beach Party,robert lee king lauren ambrose comedy gay
3787,20468,The Big Tease,kevin allen craig ferguson comedy hairdresser
3788,242575,"Guten Tag, Ramón",jorge ramírez suárez adriana barraza drama germany
3789,44945,Trust,david schwimmer clive owen crime rape
3790,29122,An Everlasting Piece,barry levinson barry mcevoy comedy toupee
3791,125123,Among Giants,sam miller pete postlethwaite comedy yorkshire
3792,111190,Adore,anne fontaine naomi watts drama lovers
3794,54580,Mondays in the Sun,fernando león de aranoa javier bardem drama spain
3795,52015,Stake Land,jim mickle danielle harris drama male nudity
3796,34941,The Last Time I Committed Suicide,stephen t. kay thomas jane drama independent film
3797,227975,Futuro Beach,karim aïnouz wagner moura drama germany
3799,81390,A Lonely Place to Die,julian gilbey melissa george adventure terror
3801,225235,The Geographer Drank His Globe Away,aleksandr veledinskiy konstantin khabenskiy drama alcohol
3802,14902,1776,peter h. hunt william daniels drama usa
3803,121676,Inescapable,ruba nadda alexander siddig thriller woman director
3804,22301,Hell's Angels,james whale ben lyon action world war i
3805,20065,Purple Violets,edward burns selma blair comedy independent film
3806,257087,The Veil,phil joanou jessica alba horror cult
3807,46420,The Loved Ones,sean byrne xavier samuel horror killing
3810,251979,The Perfect Wave,bruce macdonald scott eastwood romance biography
3811,874,A Man for All Seasons,fred zinnemann paul scofield drama england
3812,10774,Network,sidney lumet faye dunaway drama corruption
3813,770,Gone with the Wind,victor fleming vivien leigh drama life and death
3814,266102,Desert Dancer,richard raymond freida pinto drama dance
3815,29715,Major Dundee,sam peckinpah charlton heston war mexico
3816,25209,Annie Get Your Gun,george sidney betty hutton action musical
3817,37495,Four Lions,chris morris riz ahmed comedy terrorism
3818,29262,The House of Sand,andrucha waddington fernanda montenegro drama brazil
3819,34769,Defendor,peter stebbings woody harrelson drama crime fighter
3820,35032,The Pirate,vincente minnelli judy garland music musical
